{
  "$schema": "https://json-schema.org/draft/2020-12/schema",
  "$id": "https://loop-practice.local/schemas/practice-unit.schema.json",
  "title": "Loop Knowledge Practice Unit",
  "type": "object",
  "required": ["schema_version", "id", "title", "subtitle", "status", "estimated_minutes", "knowledge_refs", "stages"],
  "properties": {
    "schema_version": { "const": 3 },
    "id": { "type": "string", "pattern": "^[a-z0-9_.-]+$" },
    "title": { "type": "string", "minLength": 1 },
    "subtitle": { "type": "string", "minLength": 1 },
    "status": { "enum": ["draft", "evolving", "maintained", "archived"] },
    "estimated_minutes": { "type": "integer", "minimum": 1 },
    "knowledge_refs": {
      "type": "array",
      "minItems": 1,
      "items": {
        "type": "object",
        "required": ["source_id", "id", "path"],
        "properties": {
          "source_id": { "type": "string", "pattern": "^[a-z0-9_.-]+$" },
          "id": { "type": "string", "minLength": 1 },
          "path": { "type": "string", "minLength": 1 }
        },
        "additionalProperties": false
      }
    },
    "stages": {
      "type": "object",
      "required": ["learning", "guided", "reconstruction", "professional"],
      "properties": {
        "learning": { "$ref": "#/$defs/learningStage" },
        "guided": { "$ref": "#/$defs/trainingStage" },
        "reconstruction": { "$ref": "#/$defs/trainingStage" },
        "professional": { "$ref": "#/$defs/trainingStage" }
      },
      "additionalProperties": false
    }
  },
  "$defs": {
    "learningStage": {
      "type": "object",
      "required": ["title", "purpose", "book_file"],
      "properties": {
        "title": { "type": "string", "minLength": 1 },
        "purpose": { "type": "string", "minLength": 1 },
        "book_file": { "type": "string", "const": "book.json" }
      },
      "additionalProperties": false
    },
    "trainingStage": {
      "type": "object",
      "required": ["title", "purpose", "items_file"],
      "properties": {
        "title": { "type": "string", "minLength": 1 },
        "purpose": { "type": "string", "minLength": 1 },
        "items_file": { "type": "string", "pattern": "^[a-z0-9_./-]+\\.json$" }
      },
      "additionalProperties": false
    }
  },
  "additionalProperties": false
}
